{
  "schema_version": 1,
  "suite_id": "parcel-acoustic-loop-v1",
  "runner_version": "virtual-pipewire-rig-v1",
  "tier": 1,
  "rng_seed": 20260804,
  "started_utc": "2026-08-08T00:48:36Z",
  "duration_s": 134.2,
  "families": [
    "endpointing",
    "bargein",
    "duplex",
    "prosody"
  ],
  "audio_profile": "virtual-pipewire-null-sink",
  "node_prefix": "parcel_acoustic_3940970",
  "manifest_sha256": "7e028e66aed06f360021a4c45aa8d6783893f10c8d384afe7fe9a005e8e526b4",
  "locked_files": [
    {
      "path": "evals/companion/acoustic_loop_v1/fixtures/complete_01.wav",
      "sha256": "da91a44cf445abab50b534f537fb0c605d58f8bb3580c637552e7ba077d735e7"
    },
    {
      "path": "evals/companion/acoustic_loop_v1/fixtures/complete_02.wav",
      "sha256": "b5a5b83c5022d23da2bb3a8ed7029a540f8d4abeae38f4ae5f331a82a74cd225"
    },
    {
      "path": "evals/companion/acoustic_loop_v1/fixtures/complete_03.wav",
      "sha256": "ec6e95c6b0a2f17f64da18a2c7181a551bebb1011786449da58f5b170e5688d5"
    },
    {
      "path": "evals/companion/acoustic_loop_v1/fixtures/complete_04.wav",
      "sha256": "ffa0aaeb62ff9b55f38637c9eadf81328dee52eb1b316bd7d06792fc8720843a"
    },
    {
      "path": "evals/companion/acoustic_loop_v1/fixtures/complete_05.wav",
      "sha256": "ab4f675a6a57a34145dbc0dae9fe9a0b00ad849025cf040585b09d62ce7dbfc5"
    },
    {
      "path": "evals/companion/acoustic_loop_v1/fixtures/complete_06.wav",
      "sha256": "2b59c5fc4adbc40e0ffd885c54985af73fbc05492f765e4bdaeaa9b4432affcb"
    },
    {
      "path": "evals/companion/acoustic_loop_v1/fixtures/expressive_01.wav",
      "sha256": "835540b8ced2db06abf2d9a3bed7b612cde55d02b8fc0f75fd9fc37c9dc78bcc"
    },
    {
      "path": "evals/companion/acoustic_loop_v1/fixtures/incomplete_01.wav",
      "sha256": "7467434f3b371819bf974456038d1763e92b46cc92a2bba88b12cc443c7c5eb4"
    },
    {
      "path": "evals/companion/acoustic_loop_v1/fixtures/incomplete_02.wav",
      "sha256": "440bf20fcdd3dfea52f277f4d8aad72cf8f2ae87effcf106b1f2eb7f0da3b7e5"
    },
    {
      "path": "evals/companion/acoustic_loop_v1/fixtures/incomplete_03.wav",
      "sha256": "a602b716e2fa527dad525581d043e7dbc1af8267accb18eff00b6a77beca13cc"
    },
    {
      "path": "evals/companion/acoustic_loop_v1/fixtures/incomplete_04.wav",
      "sha256": "fda52c6f258e9ea2110dc1be846fc2964b6aa9df608dc3cf9b136fa361e02503"
    },
    {
      "path": "evals/companion/acoustic_loop_v1/fixtures/interrupt_01.wav",
      "sha256": "1f7bfae2e73d3ce5831ae0f04902acb4c10ab90b62a6a0ce8d21e306793f59be"
    },
    {
      "path": "evals/companion/acoustic_loop_v1/fixtures/interrupt_02.wav",
      "sha256": "0fbaa79af7aff66b9df1381c7c9a9406bfffdd968857994a55d92177e6e0c044"
    },
    {
      "path": "evals/companion/acoustic_loop_v1/fixtures/noise_01.wav",
      "sha256": "5bcdff7e23b22ddeb5db52042ab3e66ae1cab75d88ac73d4aa81f27546067d3f"
    },
    {
      "path": "evals/companion/acoustic_loop_v1/fixtures/noise_02.wav",
      "sha256": "12be1ea4acffb99ae5436a477ec9ce9961e673fe8582fe526b1e3a18ddb188a5"
    },
    {
      "path": "evals/companion/acoustic_loop_v1/fixtures/pause_01.wav",
      "sha256": "760b2a18c8f6162b246bacaa0a5817fcfe2457414ba5c4de6fd1c18b22cb19cc"
    },
    {
      "path": "evals/companion/acoustic_loop_v1/fixtures/pause_02.wav",
      "sha256": "5bc23d5b9386886d9784d80c4f7dfd02c45d0196f22725c62ee8c041cca4bc0e"
    },
    {
      "path": "evals/companion/acoustic_loop_v1/fixtures/pause_03.wav",
      "sha256": "35a12f365a5f25a832af9a8c41e445faf56dc11ea11dbb302f266e326ffc143e"
    },
    {
      "path": "evals/companion/acoustic_loop_v1/fixtures/query_01.wav",
      "sha256": "f2bf1624302f2e30166bb59b3a9bd67210de2636716b7488bf104168f04de469"
    },
    {
      "path": "evals/companion/acoustic_loop_v1/fixtures/query_02.wav",
      "sha256": "b54a67cbdc84ac589274d44a2d3fc6de15bef1196a203367c77882ddecc7494c"
    },
    {
      "path": "evals/companion/acoustic_loop_v1/fixtures/query_03.wav",
      "sha256": "d4459dc8f7e4c3c5beebbea09c3db34bef9621d64a405c673447aceb4e3363ce"
    },
    {
      "path": "evals/companion/acoustic_loop_v1/fixtures/robot_long_01.wav",
      "sha256": "3c971ec514fa1d96fe85425feb27bdf30bc14a2917d633c2f555009d5823e357"
    },
    {
      "path": "evals/companion/acoustic_loop_v1/fixtures/corpus.json",
      "sha256": "0e45b5c4c6f67a43bfeeb4cd1533083cd1e5042e026e22e96600c16dd2704881"
    },
    {
      "path": "evals/companion/acoustic_loop_v1/result.schema.json",
      "sha256": "2551939a24f5ab67690c354f66e886d6061f061268675ee0a70cd9e5b4d0db9b"
    },
    {
      "path": "models/endpointing/silero_vad_v6.onnx",
      "sha256": "1a153a22f4509e292a94e67d6f9b85e8deb25b4988682b7e174c65279d8788e3"
    },
    {
      "path": "models/endpointing/smart_turn_v3.onnx",
      "sha256": "2bb026316b14a660486a75b1733cd3fbab8c2fd0314dc9af7be49f8cca967e4f"
    },
    {
      "path": "models/piper/voice.onnx",
      "sha256": "5efe09e69902187827af646e1a6e9d269dee769f9877d17b16b1b46eeaaf019f"
    },
    {
      "path": "third_party/piper/piper",
      "sha256": "12672a94ca6716e5a8f335cfa68bf43bd9a33284960e3f9d16b85090bf7aab6b"
    },
    {
      "path": "third_party/whisper.cpp-bin/whisper-bin-ubuntu-x64/whisper-server",
      "sha256": "f83e389b2361f5c6abe2728ecbe4627649071e394b5bf6c393896c19bded643a"
    },
    {
      "path": "models/whisper/ggml-base.en.bin",
      "sha256": "a03779c86df3323075f5e796cb2ce5029f00ec8869eee3fdfb897afe36c6d002"
    }
  ],
  "environment": {
    "python": "3.14.4",
    "platform": "Linux-7.0.0-28-generic-x86_64-with-glibc2.43",
    "pipewire": "Compiled with libpipewire 1.6.2"
  },
  "orphan_nodes_after_teardown": [],
  "teardown_clean": true,
  "case_count": 25,
  "cases": [
    {
      "name": "complete_01",
      "kind": "complete",
      "family": "endpointing",
      "fired": true,
      "captured_s": 3.87,
      "capture_onset_s": 1.05,
      "ground_truth_end_s": 3.098,
      "commit_s": 3.84,
      "ep_s": 0.742,
      "cutoff": false,
      "verdict": "ok",
      "endpointer_detail": "smart-turn-v3"
    },
    {
      "name": "complete_02",
      "kind": "complete",
      "family": "endpointing",
      "fired": true,
      "captured_s": 3.09,
      "capture_onset_s": 1.01,
      "ground_truth_end_s": 2.29,
      "commit_s": 3.06,
      "ep_s": 0.77,
      "cutoff": false,
      "verdict": "ok",
      "endpointer_detail": "smart-turn-v3"
    },
    {
      "name": "complete_03",
      "kind": "complete",
      "family": "endpointing",
      "fired": true,
      "captured_s": 3.21,
      "capture_onset_s": 1.0,
      "ground_truth_end_s": 2.408,
      "commit_s": 3.18,
      "ep_s": 0.772,
      "cutoff": false,
      "verdict": "ok",
      "endpointer_detail": "smart-turn-v3"
    },
    {
      "name": "complete_04",
      "kind": "complete",
      "family": "endpointing",
      "fired": true,
      "captured_s": 3.6,
      "capture_onset_s": 1.08,
      "ground_truth_end_s": 2.712,
      "commit_s": 3.57,
      "ep_s": 0.858,
      "cutoff": false,
      "verdict": "ok",
      "endpointer_detail": "smart-turn-v3"
    },
    {
      "name": "complete_05",
      "kind": "complete",
      "family": "endpointing",
      "fired": true,
      "captured_s": 3.33,
      "capture_onset_s": 1.01,
      "ground_truth_end_s": 2.546,
      "commit_s": 3.3,
      "ep_s": 0.754,
      "cutoff": false,
      "verdict": "ok",
      "endpointer_detail": "smart-turn-v3"
    },
    {
      "name": "complete_06",
      "kind": "complete",
      "family": "endpointing",
      "fired": true,
      "captured_s": 3.87,
      "capture_onset_s": 1.0,
      "ground_truth_end_s": 3.144,
      "commit_s": 3.84,
      "ep_s": 0.696,
      "cutoff": false,
      "verdict": "ok",
      "endpointer_detail": "smart-turn-v3"
    },
    {
      "name": "incomplete_01",
      "kind": "incomplete",
      "family": "endpointing",
      "fired": true,
      "captured_s": 5.4,
      "capture_onset_s": 1.04,
      "ground_truth_end_s": 2.768,
      "commit_s": 5.37,
      "ep_s": 2.602,
      "cutoff": false,
      "verdict": "ok",
      "endpointer_detail": "smart-turn-v3"
    },
    {
      "name": "incomplete_02",
      "kind": "incomplete",
      "family": "endpointing",
      "fired": true,
      "captured_s": 2.97,
      "capture_onset_s": 1.19,
      "ground_truth_end_s": 2.214,
      "commit_s": 2.94,
      "ep_s": 0.726,
      "cutoff": false,
      "verdict": "ok",
      "endpointer_detail": "smart-turn-v3"
    },
    {
      "name": "incomplete_03",
      "kind": "incomplete",
      "family": "endpointing",
      "fired": true,
      "captured_s": 5.52,
      "capture_onset_s": 1.04,
      "ground_truth_end_s": 2.896,
      "commit_s": 5.49,
      "ep_s": 2.594,
      "cutoff": false,
      "verdict": "ok",
      "endpointer_detail": "smart-turn-v3"
    },
    {
      "name": "incomplete_04",
      "kind": "incomplete",
      "family": "endpointing",
      "fired": true,
      "captured_s": 3.6,
      "capture_onset_s": 1.04,
      "ground_truth_end_s": 2.736,
      "commit_s": 3.57,
      "ep_s": 0.834,
      "cutoff": false,
      "verdict": "ok",
      "endpointer_detail": "smart-turn-v3"
    },
    {
      "name": "pause_01",
      "kind": "pause_heavy",
      "family": "endpointing",
      "fired": true,
      "captured_s": 5.01,
      "capture_onset_s": 1.04,
      "ground_truth_end_s": 4.176,
      "commit_s": 4.98,
      "ep_s": 0.804,
      "cutoff": false,
      "verdict": "ok",
      "endpointer_detail": "smart-turn-v3"
    },
    {
      "name": "pause_02",
      "kind": "pause_heavy",
      "family": "endpointing",
      "fired": true,
      "captured_s": 4.74,
      "capture_onset_s": 1.05,
      "ground_truth_end_s": 3.834,
      "commit_s": 4.71,
      "ep_s": 0.876,
      "cutoff": false,
      "verdict": "ok",
      "endpointer_detail": "smart-turn-v3"
    },
    {
      "name": "pause_03",
      "kind": "pause_heavy",
      "family": "endpointing",